Sauteed Dolphin with Peach,N
Fried Lamb with Zucchini,N
Salted Turkey with Plum,N
Fried Lobster with Onion,N
Fried Lobster with Watercress,N
Fried Moose with Garlic,N
Fried Moose with Mushrooms,N
Fried Moose with Spaghetti,N
Fried Moose with Spinach,N
Fried Mouse with Noodles,N
Fried Mouse with Peach,N
Salted Turkey with Peanuts,N
Salted Turkey with Noodles,N
Fried Mutton with Carrots,N
Fried Mutton with Kiwi,N
Salted Tilapia with Radish,N
Fried Lamb with Grapes,N
Fried Lamb with Banana,N
Fried Hog with Cashews,N
Sauteed Dolphin with Carrots,N
Sauteed Dolphin with Bokchoy,N
Sauteed Clam with Rice,N
Sauteed Clam with Linguine,N
Sauteed Chicken with Yam,N
Sauteed Chicken with Quinoa,N
Sauteed Beef with Onion,N
Fried Chicken with Banana,N
Fried Clam with Rice,N
Fried Cod with Lettuce,N
Sauteed Beef with Noodles,N
Fried Crab with Eggplant,N
Fried Crab with Mushrooms,N
Fried Dolphin with Peach,N
Fried Dolphin with Pear,N
Fried Ostrich with Squash,N
Fried Oyster with Radish,N
Salted Crab with Pear,N
Frozen Hog with Spinach,N
Frozen Moose with Broccoli,N
Frozen Moose with Flour,N
Frozen Moose with Peas,N
Frozen Mouse with Plum,N
Frozen Mutton with Lettuce,N
Frozen Mutton with Onion,N
Salted Crab with Lettuce,N
Salted Cod with Eggplant,N
Salted Clam with Yam,N
Frozen Ostrich with Quinoa,N
Frozen Oyster with Pear,N
Salted Clam with Walnuts,N
Salted Clam with Spaghetti,N
Salted Dolphin with Olive,N
Frozen Dolphin with Onion,N
Frozen Cod with Rice,N
Salted Tilapia with Beans,N
Salted Swordfish with Peach,N
Fried Salmon with Grapes,N
Fried Salmon with Olive,N
Salted Oyster with Onion,N
Fried Swordfish with Cabbage,N
Fried Tilapia with Rice,N
Salted Lobster with Pistachios,N
Frozen Beef with Apple,N
Frozen Beef with Carrots,N
Salted Lamb with Radish,N
Salted Lamb with Quinoa,N
Salted Hog with Quinoa,N
Frozen Chicken with Lettuce,N
Frozen Clam with Quinoa,N
Frozen Pork with Garlic,N
Chopped Pork with Radish,N
Sauteed Shark with Kiwi,N
Sauteed Shark with Corn,N
Crushed Hog with Eggplant,N
Crushed Hog with Kiwi,N
Crushed Lamb with Broccoli,N
Crushed Lamb with Eggplant,N
Crushed Lamb with Flour,N
Crushed Lamb with Olive,N
Crushed Lobster with Quinoa,N
Crushed Lobster with Zucchini,N
Crushed Moose with Greens,N
Crushed Moose with Pistachios,N
Crushed Moose with Spinach,N
Crushed Mouse with Zucchini,N
Crushed Ostrich with Corn,N
Sauteed Shark with Peach,N
Crushed Clam with Olive,N
Crushed Clam with Cashews,N
Chopped Pork with Spaghetti,N
Chopped Pork with Walnuts,N
Smoked Beef with Cabbage,N
Chopped Shark with Watercress,N
Chopped Shark with Zucchini,N
Chopped Swordfish with Flour,N
Chopped Turkey with Kiwi,N
Chopped Turkey with Mushrooms,N
Sauteed Swordfish with Squash,N
Crushed Beef with Lettuce,N
Crushed Beef with Spaghetti,N
Sauteed Swordfish with Greens,N
Sauteed Shark with Rice,N
Crushed Chicken with Grapes,N
Crushed Chicken with Pistachios,N
Crushed Oyster with Mango,N
Crushed Oyster with Pistachios,N
Dried Crab with Kiwi,N
Dried Dolphin with Eggplant,N
Dried Dolphin with Rice,N
Sauteed Mouse with Pistachios,N
Dried Lobster with Broccoli,N
Dried Moose with Rice,N
Dried Mouse with Kale,N
Dried Mouse with Spinach,N
Sauteed Lobster with Greens,N
Sauteed Hog with Banana,N
Dried Mutton with Broccoli,N
Dried Ostrich with Mango,N
Dried Salmon with Mango,N
Dried Salmon with Pistachios,N
Dried Turkey with Cabbage,N
Dried Crab with Beans,N
Dried Cod with Kiwi,N
Dried Chicken with Broccoli,N
Crushed Salmon with Apple,N
Crushed Salmon with Spinach,N
Crushed Shark with Spaghetti,N
Crushed Shark with Zucchini,N
Crushed Swordfish with Olive,N
Crushed Swordfish with Squash,N
Crushed Tilapia with Carrots,N
Sauteed Oyster with Greens,N
Sauteed Ostrich with Kiwi,N
Sauteed Ostrich with Cabbage,N
Sauteed Ostrich with Almonds,N
Dried Beef with Banana,N
Dried Beef with Squash,N
Sauteed Mutton with Flour,N
Sauteed Mutton with Almonds,N
Dried Turkey with Walnuts,N
Frozen Pork with Lettuce,N
Ground Lobster with Watercress,N
Ground Swordfish with Mango,N
Ground Turkey with Kiwi,N
Pulverized Swordfish with Squash,N
Pulverized Swordfish with Pear,N
Pulverized Swordfish with Mango,N
Pulverized Swordfish with Cashews,N
Pulverized Shark with Carrots,N
Pulverized Salmon with Corn,N
Mashed Clam with Apple,N
Mashed Clam with Cabbage,N
Mashed Clam with Mushrooms,N
Mashed Clam with Watercress,N
Mashed Cod with Kiwi,N
Pulverized Pork with Squash,N
Pulverized Pork with Bokchoy,N
Pulverized Tilapia with Squash,N
Ground Shark with Apple,N
Pulverized Turkey with Spinach,N
Ground Moose with Almonds,N
Ground Moose with Broccoli,N
Ground Mouse with Apple,N
Ground Mouse with Linguine,N
Ground Mutton with Kiwi,N
Ground Mutton with Pistachios,N
Roasted Clam with Kiwi,N
Roasted Chicken with Squash,N
Ground Ostrich with Banana,N
Ground Ostrich with Grapes,N
Ground Ostrich with Peas,N
Ground Oyster with Zucchini,N
Ground Pork with Grapes,N
Ground Pork with Lettuce,N
Ground Pork with Yam,N
Mashed Lamb with Mushrooms,N
Mashed Lamb with Noodles,N
Pulverized Mouse with Noodles,N
Pulverized Beef with Eggplant,N
Pulverized Beef with Kale,N
Pulverized Beef with Rice,N
Pulverized Lobster with Peas,N
Pulverized Chicken with Kale,N
Pulverized Chicken with Lettuce,N
Pulverized Chicken with Noodles,N
Pulverized Chicken with Watercress,N
Pulverized Clam with Lettuce,N
Pulverized Cod with Squash,N
Pulverized Lobster with Linguine,N
Pulverized Crab with Flour,N
Pulverized Crab with Mango,N
Pulverized Dolphin with Peanuts,N
Pulverized Mouse with Rice,N
Mashed Turkey with Quinoa,N
Pulverized Mouse with Spinach,N
Mashed Lamb with Peanuts,N
Mashed Lamb with Watercress,N
Mashed Moose with Kale,N
Mashed Mouse with Beans,N
Mashed Mutton with Peach,N
Mashed Ostrich with Kiwi,N
Mashed Oyster with Pear,N
Pulverized Oyster with Radish,N
Pulverized Ostrich with Watercress,N
Mashed Salmon with Kiwi,N
Mashed Salmon with Peach,N
Mashed Salmon with Walnuts,N
Mashed Shark with Noodles,N
Mashed Shark with Onion,N
Pulverized Mutton with Kiwi,N
Pulverized Dolphin with Walnuts,N
Salted Clam with Olive,N
Grilled Dolphin with Bokchoy,N
Grilled Dolphin with Broccoli,N
Grilled Hog with Banana,N
Grilled Hog with Peach,N
Grilled Lamb with Broccoli,N
Grilled Lamb with Onion,N
Roasted Oyster with Yam,N
Grilled Lobster with Eggplant,N
Grilled Lobster with Greens,N
Roasted Oyster with Pear,N
Grilled Moose with Quinoa,N
Grilled Moose with Squash,N
Grilled Mutton with Peas,N
Roasted Oyster with Carrots,N
Grilled Ostrich with Pear,N
Grilled Crab with Rice,N
Grilled Crab with Corn,N
Grilled Cod with Pistachios,N
Frozen Salmon with Onion,N
Frozen Salmon with Walnuts,N
Salted Chicken with Mango,N
Frozen Swordfish with Kale,N
Frozen Tilapia with Pistachios,N
Frozen Turkey with Almonds,N
Frozen Turkey with Cabbage,N
Salted Beef with Walnuts,N
Roasted Turkey with Plum,N
Roasted Tilapia with Watercress,N
Roasted Tilapia with Mango,N
Roasted Swordfish with Carrots,N
Roasted Salmon with Kiwi,N
Grilled Clam with Spinach,N
Grilled Cod with Carrots,N
Grilled Ostrich with Pistachios,N
Grilled Oyster with Peanuts,N
Ground Cod with Banana,N
Ground Cod with Zucchini,N
Ground Dolphin with Banana,N
Roasted Dolphin with Kiwi,N
Roasted Crab with Carrots,N
Ground Hog with Grapes,N
Ground Hog with Kale,N
Ground Hog with Onion,N
Ground Hog with Zucchini,N
Roasted Cod with Spaghetti,N
Ground Lamb with Kiwi,N
Roasted Clam with Zucchini,N
Roasted Clam with Plum,N
Roasted Clam with Peanuts,N
Ground Lobster with Mushrooms,N
Ground Cod with Apple,N
Ground Clam with Beans,N
Ground Chicken with Bokchoy,N
Grilled Oyster with Radish,N
Roasted Ostrich with Bokchoy,N
Roasted Mutton with Squash,N
Roasted Mouse with Peanuts,N
Roasted Moose with Yam,N
Grilled Pork with Carrots,N
Grilled Pork with Spaghetti,N
Grilled Salmon with Rice,N
Roasted Lobster with Mango,N
Grilled Swordfish with Quinoa,N
Grilled Turkey with Yam,N
Ground Beef with Apple,N
Ground Beef with Beans,N
Ground Beef with Cabbage,N
Ground Beef with Linguine,N
Ground Lobster with Quinoa,N
Blended Pork with Greens,N
Boiled Mouse with Beans,N
Boiled Mouse with Carrots,N
Tenderized Oyster with Grapes,N
Boiled Oyster with Lettuce,N
Tenderized Oyster with Banana,N
Tenderized Ostrich with Pear,N
Tenderized Ostrich with Kiwi,N
Tenderized Mutton with Onion,N
Tenderized Mutton with Bokchoy,N
Boiled Pork with Radish,N
Tenderized Mouse with Radish,N
Boiled Shark with Cashews,N
Boiled Shark with Mushrooms,N
Boiled Shark with Pistachios,N
Boiled Moose with Mushrooms,N
Boiled Lobster with Watercress,N
Boiled Lobster with Mango,N
Blended Salmon with Onion,N
Tenderized Swordfish with Radish,N
Blended Swordfish with Cabbage,N
Blended Swordfish with Kale,N
Blended Tilapia with Pear,N
Blended Turkey with Olive,N
Tenderized Swordfish with Pistachios,N
Tenderized Swordfish with Corn,N
Tenderized Pork with Bokchoy,N
Boiled Chicken with Squash,N
Boiled Crab with Peach,N
Boiled Dolphin with Noodles,N
Boiled Hog with Plum,N
Tenderized Oyster with Lettuce,N
Tenderized Mouse with Mushrooms,N
Tenderized Moose with Peanuts,N
Braised Clam with Pistachios,N
Braised Cod with Linguine,N
Braised Cod with Peanuts,N
Braised Crab with Quinoa,N
Braised Dolphin with Olive,N
Tenderized Dolphin with Onion,N
Tenderized Crab with Radish,N
Braised Hog with Lettuce,N
Braised Hog with Linguine,N
Braised Hog with Peanuts,N
Tenderized Shark with Quinoa,N
Tenderized Beef with Flour,N
Tenderized Beef with Cashews,N
Braised Mutton with Peach,N
Braised Clam with Linguine,N
Tenderized Hog with Olive,N
Tenderized Hog with Pistachios,N
Tenderized Moose with Corn,N
Tenderized Moose with Cabbage,N
Tenderized Moose with Bokchoy,N
Boiled Swordfish with Corn,N
Boiled Swordfish with Kale,N
Boiled Swordfish with Rice,N
Boiled Tilapia with Noodles,N
Boiled Turkey with Rice,N
Boiled Turkey with Spaghetti,N
Tenderized Lamb with Peach,N
Tenderized Lamb with Onion,N
Tenderized Lamb with Grapes,N
Braised Beef with Olive,N
Braised Beef with Radish,N
Braised Mutton with Watercress,N
Caramelized Tilapia with Cashews,N
Baked Moose with Spaghetti,N
Baked Mouse with Eggplant,N
Baked Mouse with Lettuce,N
Baked Mutton with Pear,N
Baked Mutton with Squash,N
Tossed Pork with Watercress,N
Baked Ostrich with Zucchini,N
Tossed Pork with Radish,N
Tossed Pork with Pear,N
Tossed Oyster with Banana,N
Baked Shark with Linguine,N
Baked Shark with Yam,N
Tossed Ostrich with Squash,N
Tossed Ostrich with Quinoa,N
Baked Lobster with Eggplant,N
Baked Lamb with Zucchini,N
Baked Hog with Radish,N
Baked Beef with Rice,N
Tossed Turkey with Plum,N
Tossed Turkey with Noodles,N
Tossed Tilapia with Plum,N
Baked Chicken with Peach,N
Tossed Tilapia with Carrots,N
Tossed Tilapia with Broccoli,N
Baked Crab with Apple,N
Baked Crab with Mango,N
Baked Dolphin with Cabbage,N
Baked Dolphin with Flour,N
Baked Dolphin with Peanuts,N
Tossed Swordfish with Cashews,N
Baked Hog with Apple,N
Tossed Ostrich with Eggplant,N
Tossed Mutton with Cashews,N
Blended Moose with Cabbage,N
Blended Moose with Lettuce,N
Blended Moose with Watercress,N
Blended Mouse with Onion,N
Tossed Dolphin with Apple,N
Blended Mutton with Pistachios,N
Blended Mutton with Spinach,N
Tossed Crab with Peas,N
Tossed Cod with Spinach,N
Tossed Cod with Radish,N
Blended Oyster with Kale,N
Blended Oyster with Lettuce,N
Tossed Cod with Mango,N
Tossed Clam with Onion,N
Blended Lobster with Greens,N
Tossed Pork with Almonds,N
Blended Lamb with Broccoli,N
Baked Swordfish with Carrots,N
Baked Swordfish with Eggplant,N
Baked Swordfish with Garlic,N
Baked Tilapia with Squash,N
Baked Turkey with Banana,N
Tossed Mutton with Beans,N
Blended Beef with Cabbage,N
Blended Chicken with Olive,N
Blended Clam with Carrots,N
Blended Clam with Flour,N
Blended Clam with Garlic,N
Tossed Hog with Cashews,N
Tossed Hog with Cabbage,N
Blended Lamb with Banana,N
Tossed Chicken with Corn,N
Braised Oyster with Noodles,N
Smoked Shark with Pear,N
Smoked Crab with Broccoli,N
Smoked Salmon with Quinoa,N
Caramelized Hog with Radish,N
Smoked Crab with Pear,N
Caramelized Lamb with Kale,N
Smoked Dolphin with Apple,N
Caramelized Lobster with Squash,N
Chopped Dolphin with Mushrooms,N
Chopped Dolphin with Linguine,N
Chopped Crab with Bokchoy,N
Chopped Hog with Broccoli,N
Caramelized Dolphin with Spaghetti,N
Smoked Shark with Onion,N
Caramelized Chicken with Cashews,N
Caramelized Chicken with Flour,N
Caramelized Chicken with Pear,N
Caramelized Cod with Broccoli,N
Smoked Salmon with Zucchini,N
Caramelized Crab with Cashews,N
Chopped Lobster with Banana,N
Chopped Hog with Mango,N
Caramelized Dolphin with Onion,N
Chopped Moose with Squash,N
Caramelized Mouse with Flour,N
Caramelized Mouse with Noodles,N
Smoked Mouse with Spinach,N
Caramelized Oyster with Lettuce,N
Caramelized Oyster with Quinoa,N
Smoked Oyster with Kale,N
Smoked Ostrich with Zucchini,N
Smoked Ostrich with Lettuce,N
Smoked Ostrich with Greens,N
Smoked Mutton with Spinach,N
Caramelized Salmon with Kiwi,N
Caramelized Shark with Cashews,N
Smoked Mouse with Broccoli,N
Caramelized Swordfish with Pistachios,N
Caramelized Mutton with Flour,N
Smoked Hog with Squash,N
Caramelized Mutton with Mango,N
Smoked Lamb with Plum,N
Smoked Lobster with Cashews,N
Smoked Lobster with Garlic,N
Caramelized Tilapia with Mushrooms,N
Smoked Lobster with Spinach,N
Caramelized Mutton with Peach,N
Caramelized Tilapia with Cabbage,N
Caramelized Shark with Zucchini,N
Chopped Ostrich with Beans,N
Chopped Oyster with Plum,N
Chopped Ostrich with Peas,N
Braised Salmon with Pistachios,N
Smoked Turkey with Onion,N
Chopped Ostrich with Peanuts,N
Chopped Ostrich with Olive,N
Smoked Turkey with Plum,N
Smoked Chicken with Watercress,N
Braised Turkey with Squash,N
Braised Turkey with Onion,N
Braised Tilapia with Mango,N
Chopped Ostrich with Almonds,N
Smoked Oyster with Zucchini,N
Braised Salmon with Spinach,N
Braised Salmon with Garlic,N
Smoked Cod with Grapes,N
Smoked Tilapia with Broccoli,N
Chopped Moose with Bokchoy,N
Smoked Swordfish with Corn,N
Smoked Tilapia with Cabbage,N
Smoked Turkey with Banana,N
Braised Tilapia with Pear,N
Smoked Swordfish with Cabbage,N
Chopped Mouse with Noodles,N
Smoked Swordfish with Banana,N
Smoked Shark with Walnuts,N
Smoked Beef with Linguine,N
Pulverized Kale with Zucchini,Y
Smoked Noodles with Bokchoy,Y
Roasted Apple with Yam,Y
Roasted Almonds with Peanuts,Y
Tossed Kale with Olive,Y
Sauteed Pistachios with Squash,Y
Sauteed Plum with Corn,Y
Sauteed Plum with Spinach,Y
Tossed Mushrooms with Eggplant,Y
Sauteed Quinoa with Walnuts,Y
Tossed Mango with Quinoa,Y
Roasted Beans with Spaghetti,Y
Roasted Broccoli with Linguine,Y
Smoked Bokchoy with Kiwi,Y
Tossed Eggplant with Peas,Y
Smoked Cabbage with Mushrooms,Y
Smoked Mushrooms with Flour,Y
Smoked Cabbage with Rice,Y
Tossed Eggplant with Almonds,Y
Pulverized Linguine with Cashews,Y
Tossed Garlic with Greens,Y
Smoked Almonds with Corn,Y
Tossed Grapes with Quinoa,Y
Sauteed Peanuts with Peanuts,Y
Tossed Kale with Cabbage,Y
Roasted Cabbage with Walnuts,Y
Pulverized Linguine with Carrots,Y
Tossed Yam with Watercress,Y
Sauteed Squash with Eggplant,Y
Tossed Mushrooms with Zucchini,Y
Pulverized Pistachios with Onion,Y
Pulverized Pistachios with Olive,Y
Tossed Garlic with Banana,Y
Tossed Squash with Radish,Y
Tossed Spinach with Radish,Y
Pulverized Noodles with Carrots,Y
Pulverized Noodles with Greens,Y
Pulverized Peas with Radish,Y
Pulverized Peas with Pistachios,Y
Smoked Corn with Peach,Y
Pulverized Noodles with Kiwi,Y
Pulverized Pear with Pear,Y
Pulverized Peanuts with Rice,Y
Pulverized Peanuts with Onion,Y
Smoked Grapes with Olive,Y
Tossed Rice with Squash,Y
Tossed Pear with Peach,Y
Tossed Peanuts with Spaghetti,Y
Smoked Apple with Linguine,Y
Pulverized Squash with Lettuce,Y
Pulverized Rice with Rice,Y
Pulverized Radish with Linguine,Y
Pulverized Quinoa with Broccoli,Y
Pulverized Peanuts with Cashews,Y
Smoked Carrots with Linguine,Y
Smoked Cashews with Greens,Y
Pulverized Mango with Radish,Y
Pulverized Mango with Spinach,Y
Smoked Eggplant with Squash,Y
Sauteed Radish with Yam,Y
Pulverized Plum with Peach,Y
Pulverized Plum with Beans,Y
Sauteed Spinach with Corn,Y
Tossed Peanuts with Cabbage,Y
Pulverized Onion with Peanuts,Y
Sauteed Garlic with Watercress,Y
Roasted Zucchini with Spinach,Y
Salted Banana with Banana,Y
Sauteed Broccoli with Noodles,Y
Smoked Squash with Corn,Y
Tenderized Mango with Spinach,Y
Salted Corn with Broccoli,Y
Tenderized Kiwi with Yam,Y
Tenderized Kiwi with Watercress,Y
Sauteed Beans with Corn,Y
Sauteed Almonds with Linguine,Y
Roasted Zucchini with Grapes,Y
Roasted Walnuts with Squash,Y
Sauteed Garlic with Peas,Y
Sauteed Flour with Flour,Y
Roasted Radish with Squash,Y
Sauteed Flour with Eggplant,Y
Roasted Radish with Walnuts,Y
Sauteed Flour with Carrots,Y
Roasted Spaghetti with Watercress,Y
Tenderized Mushrooms with Onion,Y
Tenderized Mushrooms with Noodles,Y
Roasted Walnuts with Lettuce,Y
Tenderized Kale with Kale,Y
Salted Zucchini with Noodles,Y
Salted Zucchini with Corn,Y
Salted Pear with Eggplant,Y
Tenderized Carrots with Lettuce,Y
Salted Peas with Watercress,Y
Salted Rice with Grapes,Y
Tenderized Broccoli with Apple,Y
Tenderized Bokchoy with Grapes,Y
Smoked Zucchini with Mango,Y
Tenderized Almonds with Beans,Y
Tenderized Apple with Peas,Y
Tenderized Almonds with Eggplant,Y
Smoked Yam with Plum,Y
Tenderized Carrots with Walnuts,Y
Salted Watercress with Spinach,Y
Salted Watercress with Beans,Y
Tenderized Greens with Cashews,Y
Salted Kiwi with Onion,Y
Salted Kiwi with Radish,Y
Tenderized Grapes with Plum,Y
Tenderized Eggplant with Walnuts,Y
Tenderized Corn with Almonds,Y
Salted Mango with Cabbage,Y
Salted Mango with Garlic,Y
Tenderized Apple with Kiwi,Y
Sauteed Peanuts with Beans,Y
Roasted Greens with Cabbage,Y
Roasted Greens with Watercress,Y
Roasted Kiwi with Bokchoy,Y
Tossed Almonds with Almonds,Y
Tenderized Watercress with Kale,Y
Smoked Peach with Watercress,Y
Smoked Peanuts with Carrots,Y
Roasted Linguine with Grapes,Y
Roasted Linguine with Radish,Y
Roasted Linguine with Squash,Y
Roasted Garlic with Pear,Y
Tossed Banana with Walnuts,Y
Sauteed Peach with Mushrooms,Y
Smoked Noodles with Carrots,Y
Smoked Olive with Bokchoy,Y
Sauteed Olive with Carrots,Y
Roasted Corn with Almonds,Y
Tossed Cashews with Bokchoy,Y
Roasted Eggplant with Yam,Y
Tossed Cabbage with Cabbage,Y
Tossed Bokchoy with Rice,Y
Smoked Peach with Corn,Y
Sauteed Mushrooms with Yam,Y
Sauteed Mushrooms with Pistachios,Y
Smoked Radish with Watercress,Y
Tenderized Peas with Almonds,Y
Tenderized Pear with Peach,Y
Tenderized Pear with Linguine,Y
Tenderized Peanuts with Corn,Y
Sauteed Kale with Plum,Y
Smoked Rice with Squash,Y
Roasted Peach with Rice,Y
Sauteed Greens with Zucchini,Y
Sauteed Grapes with Mango,Y
Roasted Pistachios with Olive,Y
Sauteed Kale with Radish,Y
Tenderized Plum with Mushrooms,Y
Sauteed Mango with Zucchini,Y
Tenderized Squash with Banana,Y
Roasted Mango with Mango,Y
Tenderized Spinach with Linguine,Y
Tenderized Spaghetti with Peanuts,Y
Roasted Mushrooms with Kiwi,Y
Salted Spinach with Greens,Y
Roasted Noodles with Almonds,Y
Tenderized Radish with Zucchini,Y
Tenderized Radish with Broccoli,Y
Roasted Radish with Peanuts,Y
Caramelized Onion with Spaghetti,Y
Caramelized Apple with Walnuts,Y
Braised Zucchini with Zucchini,Y
Braised Zucchini with Yam,Y
Braised Zucchini with Banana,Y
Braised Yam with Peas,Y
Braised Yam with Cashews,Y
Braised Yam with Almonds,Y
Braised Walnuts with Spinach,Y
Caramelized Bokchoy with Lettuce,Y
Caramelized Broccoli with Linguine,Y
Caramelized Onion with Noodles,Y
Caramelized Olive with Radish,Y
Caramelized Noodles with Spinach,Y
Caramelized Lettuce with Broccoli,Y
Caramelized Flour with Kiwi,Y
Caramelized Corn with Grapes,Y
Caramelized Cabbage with Lettuce,Y
Caramelized Cabbage with Bokchoy,Y
Braised Squash with Olive,Y
Braised Rice with Kale,Y
Braised Plum with Walnuts,Y
Braised Eggplant with Walnuts,Y
Braised Eggplant with Quinoa,Y
Braised Eggplant with Peach,Y
Braised Eggplant with Broccoli,Y
Braised Corn with Flour,Y
Braised Broccoli with Beans,Y
Braised Bokchoy with Spaghetti,Y
Braised Bokchoy with Radish,Y
Braised Flour with Cabbage,Y
Braised Grapes with Rice,Y
Braised Peach with Grapes,Y
Braised Peach with Flour,Y
Braised Mushrooms with Spaghetti,Y
Braised Mango with Flour,Y
Braised Linguine with Greens,Y
Braised Kiwi with Yam,Y
Braised Kiwi with Grapes,Y
Braised Kiwi with Banana,Y
Braised Apple with Cashews,Y
Caramelized Onion with Zucchini,Y
Crushed Greens with Walnuts,Y
Chopped Pear with Squash,Y
Chopped Pear with Peas,Y
Chopped Pear with Pear,Y
Chopped Peanuts with Apple,Y
Chopped Onion with Onion,Y
Chopped Onion with Grapes,Y
Chopped Mushrooms with Peanuts,Y
Chopped Mushrooms with Corn,Y
Chopped Quinoa with Quinoa,Y
Chopped Yam with Zucchini,Y
Crushed Garlic with Cashews,Y
Crushed Flour with Watercress,Y
Crushed Cashews with Eggplant,Y
Crushed Carrots with Cashews,Y
Crushed Carrots with Bokchoy,Y
Crushed Bokchoy with Mushrooms,Y
Crushed Banana with Broccoli,Y
Crushed Apple with Greens,Y
Chopped Greens with Greens,Y
Chopped Grapes with Zucchini,Y
Chopped Garlic with Yam,Y
Caramelized Spinach with Mushrooms,Y
Caramelized Spinach with Carrots,Y
Caramelized Spaghetti with Zucchini,Y
Caramelized Rice with Plum,Y
Caramelized Plum with Onion,Y
Caramelized Plum with Kiwi,Y
Caramelized Peas with Rice,Y
Caramelized Pear with Watercress,Y
Caramelized Squash with Apple,Y
Caramelized Squash with Yam,Y
Chopped Flour with Peas,Y
Chopped Cashews with Squash,Y
Chopped Banana with Spinach,Y
Chopped Apple with Quinoa,Y
Chopped Almonds with Banana,Y
Caramelized Watercress with Onion,Y
Caramelized Walnuts with Beans,Y
Baked Almonds with Lettuce,Y
Caramelized Pear with Olive,Y
Blended Peanuts with Eggplant,Y
Blended Grapes with Watercress,Y
Blended Flour with Banana,Y
Blended Eggplant with Mango,Y
Blended Corn with Spinach,Y
Blended Cabbage with Broccoli,Y
Blended Broccoli with Mango,Y
Blended Beans with Cabbage,Y
Blended Almonds with Corn,Y
Blended Kale with Almonds,Y
Blended Kale with Linguine,Y
Blended Peach with Spaghetti,Y
Blended Olive with Onion,Y
Blended Noodles with Apple,Y
Blended Noodles with Almonds,Y
Blended Mushrooms with Corn,Y
Blended Mango with Corn,Y
Blended Linguine with Noodles,Y
Blended Linguine with Flour,Y
Baked Squash with Spinach,Y
Baked Spinach with Peas,Y
Baked Spinach with Almonds,Y
Baked Linguine with Apple,Y
Baked Lettuce with Banana,Y
Baked Greens with Watercress,Y
Baked Corn with Squash,Y
Baked Corn with Flour,Y
Baked Cashews with Cabbage,Y
Baked Broccoli with Plum,Y
Baked Broccoli with Olive,Y
Baked Mushrooms with Kale,Y
Baked Noodles with Cashews,Y
Baked Spaghetti with Garlic,Y
Baked Radish with Cabbage,Y
Baked Peas with Linguine,Y
Baked Peas with Cabbage,Y
Baked Pear with Pistachios,Y
Baked Peanuts with Greens,Y
Baked Peach with Pistachios,Y
Baked Peach with Corn,Y
Baked Banana with Quinoa,Y
Blended Pear with Beans,Y
Braised Almonds with Walnuts,Y
Boiled Quinoa with Peas,Y
Boiled Pistachios with Olive,Y
Boiled Pear with Yam,Y
Boiled Pear with Walnuts,Y
Boiled Pear with Greens,Y
Boiled Pear with Banana,Y
Boiled Peach with Noodles,Y
Boiled Mushrooms with Carrots,Y
Boiled Quinoa with Walnuts,Y
Boiled Spaghetti with Cashews,Y
Braised Almonds with Olive,Y
Boiled Zucchini with Walnuts,Y
Boiled Zucchini with Spaghetti,Y
Boiled Zucchini with Peach,Y
Boiled Squash with Beans,Y
Boiled Spinach with Plum,Y
Boiled Spinach with Peach,Y
Boiled Spaghetti with Zucchini,Y
Boiled Linguine with Radish,Y
Boiled Lettuce with Cashews,Y
Boiled Lettuce with Beans,Y
Blended Watercress with Olive,Y
Blended Walnuts with Spinach,Y
Blended Squash with Spinach,Y
Blended Squash with Pear,Y
Blended Spinach with Greens,Y
Blended Spaghetti with Peach,Y
Blended Quinoa with Broccoli,Y
Blended Peas with Mushrooms,Y
Boiled Almonds with Carrots,Y
Boiled Apple with Walnuts,Y
Boiled Kiwi with Carrots,Y
Boiled Kale with Beans,Y
Boiled Cashews with Lettuce,Y
Boiled Carrots with Squash,Y
Boiled Cabbage with Kale,Y
Boiled Broccoli with Kiwi,Y
Boiled Broccoli with Cabbage,Y
Boiled Bokchoy with Banana,Y
Blended Pear with Peanuts,Y
Ground Peanuts with Spaghetti,Y
Ground Flour with Garlic,Y
Ground Flour with Apple,Y
Ground Corn with Almonds,Y
Ground Cashews with Radish,Y
Ground Broccoli with Pear,Y
Ground Bokchoy with Walnuts,Y
Ground Bokchoy with Peas,Y
Ground Beans with Linguine,Y
Ground Garlic with Almonds,Y
Ground Kale with Linguine,Y
Ground Peanuts with Pistachios,Y
Ground Peanuts with Peach,Y
Ground Peach with Spinach,Y
Ground Onion with Squash,Y
Ground Olive with Quinoa,Y
Ground Linguine with Squash,Y
Ground Linguine with Grapes,Y
Ground Linguine with Flour,Y
Grilled Yam with Watercress,Y
Grilled Yam with Radish,Y
Grilled Spinach with Yam,Y
Grilled Kale with Broccoli,Y
Grilled Eggplant with Quinoa,Y
Grilled Eggplant with Mushrooms,Y
Grilled Corn with Greens,Y
Grilled Cashews with Spinach,Y
Grilled Carrots with Eggplant,Y
Grilled Cabbage with Corn,Y
Grilled Beans with Corn,Y
Grilled Linguine with Apple,Y
Grilled Mango with Greens,Y
Grilled Plum with Radish,Y
Grilled Plum with Mushrooms,Y
Grilled Pistachios with Squash,Y
Grilled Pistachios with Noodles,Y
Grilled Peas with Carrots,Y
Grilled Pear with Squash,Y
Grilled Peach with Rice,Y
Grilled Onion with Plum,Y
Grilled Banana with Yam,Y
Ground Pear with Quinoa,Y
Pulverized Kale with Onion,Y
Mashed Spaghetti with Walnuts,Y
Mashed Spaghetti with Lettuce,Y
Mashed Spaghetti with Greens,Y
Mashed Rice with Spaghetti,Y
Mashed Plum with Garlic,Y
Mashed Plum with Cabbage,Y
Mashed Pistachios with Pistachios,Y
Mashed Pear with Pear,Y
Mashed Spinach with Squash,Y
Mashed Squash with Carrots,Y
Pulverized Greens with Peas,Y
Pulverized Garlic with Radish,Y
Pulverized Corn with Cabbage,Y
Pulverized Carrots with Plum,Y
Pulverized Banana with Olive,Y
Pulverized Banana with Carrots,Y
Pulverized Apple with Quinoa,Y
Pulverized Almonds with Spinach,Y
Mashed Peanuts with Beans,Y
Mashed Peach with Cabbage,Y
Mashed Olive with Yam,Y
Mashed Bokchoy with Apple,Y
Mashed Beans with Banana,Y
Mashed Apple with Spinach,Y
Ground Yam with Yam,Y
Ground Yam with Linguine,Y
Ground Yam with Carrots,Y
Ground Watercress with Spinach,Y
