Ground Spaghetti with Broccoli,Y
Mashed Broccoli with Watercress,Y
Mashed Carrots with Linguine,Y
Mashed Noodles with Radish,Y
Mashed Mango with Pistachios,Y
Mashed Mango with Kiwi,Y
Mashed Kiwi with Greens,Y
Mashed Greens with Carrots,Y
Mashed Flour with Kale,Y
Mashed Eggplant with Watercress,Y
Mashed Cashews with Carrots,Y
Ground Quinoa with Olive,Y
Fried Eggplant with Spinach,Y
Dried Spinach with Walnuts,Y
Dried Spaghetti with Kiwi,Y
Dried Pistachios with Peanuts,Y
Dried Peas with Garlic,Y
Dried Pear with Almonds,Y
Dried Onion with Kale,Y
Dried Noodles with Noodles,Y
Dried Mushrooms with Zucchini,Y
Dried Yam with Kale,Y
Fried Apple with Almonds,Y
Fried Corn with Plum,Y
Fried Carrots with Walnuts,Y
Fried Cabbage with Peach,Y
Fried Broccoli with Pear,Y
Fried Beans with Walnuts,Y
Fried Beans with Bokchoy,Y
Fried Banana with Peas,Y
Fried Apple with Bokchoy,Y
Dried Mushrooms with Radish,Y
Dried Mushrooms with Eggplant,Y
Dried Mushrooms with Corn,Y
Dried Almonds with Cashews,Y
Crushed Zucchini with Pistachios,Y
Crushed Walnuts with Apple,Y
Crushed Radish with Garlic,Y
Crushed Plum with Broccoli,Y
Crushed Pistachios with Kale,Y
Crushed Pistachios with Cabbage,Y
Crushed Peas with Garlic,Y
Dried Almonds with Radish,Y
Dried Banana with Olive,Y
Dried Mango with Pear,Y
Dried Kiwi with Onion,Y
Dried Kiwi with Kale,Y
Dried Grapes with Squash,Y
Dried Carrots with Kale,Y
Dried Carrots with Garlic,Y
Dried Cabbage with Plum,Y
Dried Beans with Garlic,Y
Crushed Lettuce with Plum,Y
Fried Flour with Zucchini,Y
Grilled Banana with Squash,Y
Frozen Peanuts with Flour,Y
Frozen Onion with Plum,Y
Frozen Onion with Peas,Y
Frozen Noodles with Radish,Y
Frozen Noodles with Kale,Y
Frozen Flour with Eggplant,Y
Frozen Eggplant with Garlic,Y
Frozen Cashews with Carrots,Y
Frozen Plum with Kiwi,Y
Frozen Rice with Cashews,Y
Grilled Banana with Peas,Y
Grilled Banana with Linguine,Y
Grilled Apple with Greens,Y
Grilled Apple with Cabbage,Y
Grilled Apple with Almonds,Y
Frozen Watercress with Yam,Y
Frozen Watercress with Beans,Y
Frozen Spaghetti with Carrots,Y
Frozen Carrots with Walnuts,Y
Frozen Carrots with Noodles,Y
Frozen Cabbage with Peas,Y
Fried Peanuts with Pistachios,Y
Fried Onion with Peas,Y
Fried Mushrooms with Peach,Y
Fried Mushrooms with Garlic,Y
Fried Lettuce with Spinach,Y
Fried Kiwi with Watercress,Y
Fried Kale with Garlic,Y
Fried Greens with Radish,Y
Fried Pear with Rice,Y
Fried Plum with Radish,Y
Frozen Bokchoy with Cashews,Y
Frozen Beans with Grapes,Y
Frozen Banana with Pear,Y
Fried Walnuts with Kale,Y
Fried Spinach with Spinach,Y
Fried Spaghetti with Broccoli,Y
Fried Rice with Peanuts,Y
Fried Quinoa with Mushrooms,Y
Fried Garlic with Onion,Y
